{
  "schema_version": "vuoro.outctl.run-result/v2",
  "request_id": "req-unsupported-1",
  "engine": {"id": "python-reference", "version": "0.1.0.dev0"},
  "policy": {"snapshot_id": "snapshot-5187758301587a012d002b363894ff8a", "ref": "policy://interactive-w5", "digest": "sha256:5187758301587a012d002b363894ff8ad27f999d99e55be9a822b49f0039d3c1"},
  "outcome": "unsupported",
  "command": {"started": false, "exit_code": null, "signal": null, "timed_out": false, "cancelled": false},
  "capture": {"status": "not-requested", "ref": null, "manifest_digest": null, "complete": false},
  "presentation": {"kind": "denied", "body": null, "lossy": false, "redacted": false, "digest": null},
  "wrapper_error": {"code": "OUTCTL_PRESPAWN_UNSUPPORTED", "phase": "pre-spawn", "message_key": "explicit-shell-not-supported"}
}
