{
  "schema_version": "vuoro.outctl.run-result/v2",
  "request_id": "req-completed-1",
  "engine": {"id": "rust-w7-storage", "version": "0.1.0"},
  "policy": {"snapshot_id": "snapshot-5187758301587a012d002b363894ff8a", "ref": "policy://interactive-w5", "digest": "sha256:5187758301587a012d002b363894ff8ad27f999d99e55be9a822b49f0039d3c1"},
  "outcome": "completed",
  "command": {"started": true, "exit_code": 0, "signal": null, "timed_out": false, "cancelled": false},
  "capture": {"status": "complete", "ref": "outctl://capture/01k1w7complete/manifest/sha256/aaaaaaaaaaaaaaaaaaaaaaaaaaaaaaaaaaaaaaaaaaaaaaaaaaaaaaaaaaaaaaaa", "manifest_digest": "sha256:aaaaaaaaaaaaaaaaaaaaaaaaaaaaaaaaaaaaaaaaaaaaaaaaaaaaaaaaaaaaaaaa", "complete": true},
  "presentation": {"kind": "raw-safe", "body": "safe\n", "lossy": false, "redacted": false, "digest": "sha256:bbbbbbbbbbbbbbbbbbbbbbbbbbbbbbbbbbbbbbbbbbbbbbbbbbbbbbbbbbbbbbbb"},
  "wrapper_error": null
}
